{
  "schema": "dailyfuel/map-stations/1",
  "source": "OpenStreetMap, fetched through the Overpass API",
  "source_url": "https://www.openstreetmap.org",
  "licence": "Open Database License (ODbL) 1.0",
  "licence_url": "https://opendatacommons.org/licenses/odbl/1-0/",
  "attribution": "© OpenStreetMap contributors",
  "attribution_url": "https://www.openstreetmap.org/copyright",
  "query": "[out:json][timeout:240];area[\"ISO3166-1\"=\"US\"][\"admin_level\"=\"2\"]->.us;(nwr(area.us)[amenity=fuel][\"brand:wikidata\"~\"^(Q1872496|Q64128179|Q64130592|Q7835892|Q64051305|Q7339377)$\"];nwr(area.us)[amenity=fuel][brand~\"^(ONE9|One9)$\"];nwr(area.us)[amenity=fuel][~\"^(name|brand|operator|network)$\"~\"ambest\",i];);out center tags;",
  "osm_base": "2026-09-20T01:32:50Z",
  "fetched": "2026-09-19",
  "cluster_m": 300,
  "brands": {
    "loves": {
      "name": "Love's",
      "wikidata": "Q1872496",
      "sites": 480
    },
    "pilot": {
      "name": "Pilot",
      "wikidata": "Q64128179",
      "sites": 336
    },
    "flyingj": {
      "name": "Flying J",
      "wikidata": "Q64130592",
      "sites": 123
    },
    "ta": {
      "name": "TA",
      "wikidata": "Q7835892",
      "sites": 72
    },
    "petro": {
      "name": "Petro",
      "wikidata": "Q64051305",
      "sites": 58
    },
    "one9": {
      "name": "ONE9",
      "wikidata": null,
      "sites": 30
    },
    "roadranger": {
      "name": "Road Ranger",
      "wikidata": "Q7339377",
      "sites": 32
    }
  },
  "counts": {
    "elements": 1712,
    "sites": 1131,
    "dropped_ambest": 3,
    "dropped_outside_us": 0
  },
  "sites": [
    {
      "lat": 26.336,
      "lon": -98.14335,
      "brand": "flyingj",
      "name": "Flying J",
      "osm": [
        "w236128110",
        "w236128108"
      ]
    },
    {
      "lat": 27.68572,
      "lon": -99.4652,
      "brand": "flyingj",
      "name": "Flying J",
      "osm": [
        "w229304831",
        "w229304828"
      ]
    },
    {
      "lat": 28.01006,
      "lon": -82.30357,
      "brand": "flyingj",
      "name": "Flying J",
      "osm": [
        "w226885968",
        "w226885966"
      ]
    },
    {
      "lat": 28.32621,
      "lon": -82.32209,
      "brand": "flyingj",
      "name": "Flying J",
      "osm": [
        "w223428886",
        "w223428884"
      ]
    },
    {
      "lat": 28.45268,
      "lon": -99.23827,
      "brand": "flyingj",
      "name": "Flying J",
      "osm": [
        "w837508329",
        "w837508331"
      ]
    },
    {
      "lat": 29.44637,
      "lon": -98.36164,
      "brand": "flyingj",
      "name": "Flying J",
      "osm": [
        "w229315097",
        "w229315095"
      ]
    },
    {
      "lat": 29.77125,
      "lon": -95.12521,
      "brand": "flyingj",
      "name": "Flying J",
      "osm": [
        "n12164999677",
        "n12164999676"
      ]
    },
    {
      "lat": 29.79519,
      "lon": -95.03283,
      "brand": "flyingj",
      "name": "Flying J",
      "osm": [
        "w225720059",
        "w225720064"
      ]
    },
    {
      "lat": 29.99872,
      "lon": -95.42741,
      "brand": "flyingj",
      "name": "Flying J",
      "osm": [
        "w236128752",
        "w236128750"
      ]
    },
    {
      "lat": 30.11669,
      "lon": -93.82007,
      "brand": "flyingj",
      "name": "Flying J",
      "osm": [
        "w236133148",
        "w236133147"
      ]
    },
    {
      "lat": 30.19301,
      "lon": -95.19276,
      "brand": "flyingj",
      "name": "Flying J",
      "osm": [
        "w236130699",
        "w236130697"
      ]
    },
    {
      "lat": 30.49298,
      "lon": -84.42925,
      "brand": "flyingj",
      "name": "Flying J",
      "osm": [
        "w230492665",
        "w230492663"
      ]
    },
    {
      "lat": 30.64161,
      "lon": -83.19028,
      "brand": "flyingj",
      "name": "Flying J",
      "osm": [
        "w226930517",
        "w1010818259",
        "w226930516"
      ]
    },
    {
      "lat": 31.1406,
      "lon": -81.57856,
      "brand": "flyingj",
      "name": "Flying J",
      "osm": [
        "n10062606870",
        "n10062606869"
      ]
    },
    {
      "lat": 31.19087,
      "lon": -101.44975,
      "brand": "flyingj",
      "name": "Flying J",
      "osm": [
        "n6324408991"
      ]
    },
    {
      "lat": 31.19132,
      "lon": -85.40063,
      "brand": "flyingj",
      "name": "Flying J",
      "osm": [
        "w230484017"
      ]
    },
    {
      "lat": 31.40075,
      "lon": -103.48635,
      "brand": "flyingj",
      "name": "Flying J Travel Plaza",
      "osm": [
        "n1580677199"
      ]
    },
    {
      "lat": 31.5079,
      "lon": -97.14536,
      "brand": "flyingj",
      "name": "Flying J",
      "osm": [
        "w236134447",
        "w236134445"
      ]
    },
    {
      "lat": 31.85351,
      "lon": -103.06767,
      "brand": "flyingj",
      "name": "Flying J",
      "osm": [
        "w1284777366",
        "w1284777367"
      ]
    },
    {
      "lat": 31.8646,
      "lon": -102.30207,
      "brand": "flyingj",
      "name": "Flying J",
      "osm": [
        "w415836423",
        "w415836422"
      ]
    },
    {
      "lat": 32.44431,
      "lon": -93.97928,
      "brand": "flyingj",
      "name": "Flying J",
      "osm": [
        "w225809552",
        "w225809550"
      ]
    },
    {
      "lat": 32.46133,
      "lon": -99.87259,
      "brand": "flyingj",
      "name": "Flying J",
      "osm": [
        "w236134093",
        "w236134091"
      ]
    },
    {
      "lat": 32.73206,
      "lon": -111.5498,
      "brand": "flyingj",
      "name": "Flying J",
      "osm": [
        "n4719302823",
        "n4719302824"
      ]
    },
    {
      "lat": 33.20748,
      "lon": -84.06366,
      "brand": "flyingj",
      "name": "Flying J",
      "osm": [
        "w219843901"
      ]
    },
    {
      "lat": 33.34497,
      "lon": -96.5888,
      "brand": "flyingj",
      "name": "flying j",
      "osm": [
        "w225736502",
        "w544250303"
      ]
    },
    {
      "lat": 33.46077,
      "lon": -112.20498,
      "brand": "flyingj",
      "name": "Flying J",
      "osm": [
        "w130280941",
        "n1660172680"
      ]
    },
    {
      "lat": 33.51322,
      "lon": -93.94839,
      "brand": "flyingj",
      "name": "Flying J",
      "osm": [
        "w230490202",
        "w230490200"
      ]
    },
    {
      "lat": 33.56224,
      "lon": -86.83109,
      "brand": "flyingj",
      "name": "Flying J",
      "osm": [
        "w230483737",
        "w230483735"
      ]
    },
    {
      "lat": 33.59289,
      "lon": -101.84132,
      "brand": "flyingj",
      "name": "Flying J",
      "osm": [
        "w236129760",
        "w236129763"
      ]
    },
    {
      "lat": 33.60208,
      "lon": -114.52303,
      "brand": "flyingj",
      "name": "Flying J",
      "osm": [
        "n12007395538",
        "w230486089"
      ]
    },
    {
      "lat": 33.89058,
      "lon": -98.48316,
      "brand": "flyingj",
      "name": "Flying J",
      "osm": [
        "w236135485",
        "w236135484"
      ]
    },
    {
      "lat": 34.01541,
      "lon": -117.52533,
      "brand": "flyingj",
      "name": "Flying J",
      "osm": [
        "w978157524",
        "w978157523"
      ]
    },
    {
      "lat": 34.06326,
      "lon": -117.49378,
      "brand": "flyingj",
      "name": "flying J",
      "osm": [
        "n12101468445"
      ]
    },
    {
      "lat": 34.0647,
      "lon": -81.02351,
      "brand": "flyingj",
      "name": "Flying J",
      "osm": [
        "n3076780914"
      ]
    },
    {
      "lat": 34.20029,
      "lon": -97.1677,
      "brand": "flyingj",
      "name": "Flying J",
      "osm": [
        "n1608318101"
      ]
    },
    {
      "lat": 34.4081,
      "lon": -117.39864,
      "brand": "flyingj",
      "name": "Flying J",
      "osm": [
        "w125111198"
      ]
    },
    {
      "lat": 34.57681,
      "lon": -84.94704,
      "brand": "flyingj",
      "name": "Flying J",
      "osm": [
        "w230493063",
        "w230493064"
      ]
    },
    {
      "lat": 34.81722,
      "lon": -118.88673,
      "brand": "flyingj",
      "name": "Flying J",
      "osm": [
        "w473000129"
      ]
    },
    {
      "lat": 34.8541,
      "lon": -117.08114,
      "brand": "flyingj",
      "name": "Flying J",
      "osm": [
        "n12101432337",
        "n10088156760"
      ]
    },
    {
      "lat": 34.85572,
      "lon": -81.00589,
      "brand": "flyingj",
      "name": "Flying J",
      "osm": [
        "n11087112606",
        "n12196955564"
      ]
    },
    {
      "lat": 34.92884,
      "lon": -89.79341,
      "brand": "flyingj",
      "name": "Flying J",
      "osm": [
        "w230879553",
        "w230879554"
      ]
    },
    {
      "lat": 35.01574,
      "lon": -110.67434,
      "brand": "flyingj",
      "name": "Flying J",
      "osm": [
        "w144341226",
        "w144341264"
      ]
    },
    {
      "lat": 35.07894,
      "lon": -106.74652,
      "brand": "flyingj",
      "name": "Flying J",
      "osm": [
        "w888809753"
      ]
    },
    {
      "lat": 35.15388,
      "lon": -90.14435,
      "brand": "flyingj",
      "name": "Flying J",
      "osm": [
        "w219424151"
      ]
    },
    {
      "lat": 35.15906,
      "lon": -103.70364,
      "brand": "flyingj",
      "name": "Flying J",
      "osm": [
        "w226328543"
      ]
    },
    {
      "lat": 35.19372,
      "lon": -101.72403,
      "brand": "flyingj",
      "name": "Flying J",
      "osm": [
        "w236120078"
      ]
    },
    {
      "lat": 35.21982,
      "lon": -114.00721,
      "brand": "flyingj",
      "name": "Flying J",
      "osm": [
        "w230486476",
        "w230486477"
      ]
    },
    {
      "lat": 35.28371,
      "lon": -93.0901,
      "brand": "flyingj",
      "name": "Flying J",
      "osm": [
        "w230489757"
      ]
    },
    {
      "lat": 35.47588,
      "lon": -95.53873,